,Name,Fees,Region,Country,Type
268, University of Wisconsin-Platteville (UW Platt)  ,10000.0,Wisconsin, United States,Public University
269, East Carolina University (ECU)  ,20000.0,North Carolina, United States,Public University
270, Indiana Tech (Indiana Tech)  ,20052.0,Indiana, United States,Private University
271," City University Of New York, Brooklyn College (CUNY Br)  ",12000.0,New York, United States,Public University
272, University of Toledo (U. Toledo)  ,48000.0,Ohio, United States,Public University
273, Roosevelt University (Roosevelt)  ,19000.0,Illinois, United States,Private University
274," University of Michigan, Flint (Flint)  ",22170.0,Michigan, United States,Public University
275, Texas State University (TX State)  ,20000.0,Texas, United States,Public University
276, Swarthmore College (SC)  ,54256.0,Pennsylvania, United States,Private University
277," California State University, San Marcos (CSU SM)  ",20000.0,California, United States,Public University
278, University of North America (UoNA)  ,21060.0,Virginia, United States,Private University
279, Rivier University (Rivier)  ,9000.0,New Hampshire, United States,Private University
280, State University of New York at Binghamton (SUNY Bingh.)  ,23000.0,New York, United States,Public University
281, Kennesaw State University (Kennesaw)  ,28000.0,Georgia, United States,Public University
282, Wellesley College (WC)  ,53408.0,Massachusetts, United States,Private University
283, South Dakota School of Mines and Technology (SD Mines)  ,15000.0,South Dakota, United States,Public University
284," University of Southern Mississippi, Gulf Coast (USM Gulf)  ",50000.0,Michigan, United States,Public University
285, Texas A&M University - Corpus Christi (TAMUCC)  ,13000.0,Texas, United States,Public University
286," California State University, Northridge (CSUN)  ",6000.0,California, United States,Public University
287, Norfolk State University (Norfolk)  ,22000.0,Virginia, United States,Public University
288, International Technological University (ITU)  ,16200.0,California, United States,Private University
289, Catholic University Of America (CUA)  ,41000.0,District of Columbia, United States,Private University
290, Tulane University of Louisiana (Tulane)  ,14234.0,Louisiana, United States,Private University
291, Emory University (Emory)  ,29000.0,Georgia, United States,Private University
292, Amherst College (amherst)  ,55520.0,Massachusetts, United States,Private University
293, Dakota State University (DSU)  ,10000.0,South Dakota, United States,Public University
294, Monmouth University (Monmouth)  ,16000.0,Illinois, United States,Private University
295, Boise State University (Boise State)  ,19000.0,Idaho, United States,Public University
296, Northwestern Polytechnic University (NPU)  ,12150.0,California, United States,Private University
297, Indiana University South Bend (IUSB)  ,10000.0,Indiana, United States,Public University
298," Lipscomb University, Nashville (Lipscomb)  ",30000.0,Tennessee, United States,Private University
299, University of Mary Hardin-Baylor (UMHB)  ,29880.0,Texas, United States,Private University
300, Barnard College (barnard)  ,53252.0,New York, United States,Private University
301, Florida International University (FIU)  ,18000.0,Florida, United States,Public University
302, Southern Arkansas University (SAU Mag)  ,8000.0,Arkansas, United States,Public University
303, University of central oklahoma (UCO)  ,11808.0,Oklahoma, United States,Public University
304," California State University, San Bernardino (CSU SB)  ",24000.0,California, United States,Public University
305, Duquesne University (DUQ)  ,24768.0,Pennsylvania, United States,Private University
306, Tennessee Technological University (TN Tech)  ,22000.0,Tennessee, United States,Public University
307, University of Louisiana at Lafayette (U.SW Louisi)  ,24816.0,Louisiana, United States,Public University
308, University of Texas at Tyler (UT Tyler)  ,24588.0,Texas, United States,Public University
309, The University of Vermont (Vermont)  ,37000.0,Vermont, United States,Public University
310, Central Michigan University (C Mich)  ,12000.0,Michigan, United States,Public University
311, University of North Alabama (UNA Florence)  ,12000.0,Alabama, United States,Public University
312, Milwaukee School of Engineering (MSOE)  ,19000.0,Wisconsin, United States,Private University
313, Maharishi University of Management (MUM)  ,27530.0,Iowa, United States,Private University
314," California State University, Los Angeles (CSU LA)  ",7000.0,California, United States,Public University
315, University of central oklahoma (UCO)  ,11808.0,Oklahoma, United States,Public University
316, Central Michigan University (C Mich)  ,12000.0,Michigan, United States,Public University
317, Marshall University (Marshall)  ,17910.0,West Virginia, United States,Public University
318, Lamar University (Lamar)  ,13000.0,Texas, United States,Public University
319, Fordham University (Fordham)  ,23000.0,New York, United States,Private University
320, Duquesne University (DUQ)  ,24768.0,Pennsylvania, United States,Private University
321," California State University, Los Angeles (CSU LA)  ",7000.0,California, United States,Public University
322," Washington State University, Tri-Cities (WSU Tricities)  ",26000.0,Washington, United States,Public University
323, Murray State University (Murray State)  ,19542.0,Kentucky, United States,Public University
324, California Institute of the Arts (CalArts)  ,38960.0,California, United States,Private University
325, University of Montana (UMT)  ,26000.0,Montana, United States,Public University
326, University of Texas at El Paso (UT El Paso)  ,32243.0,Texas, United States,Public University
327," City University Of New York, Lehman College (CUNY Leh)  ",13000.0,New York, United States,Public University
328, Millersville University (Millersville)  ,27972.0,Pennsylvania, United States,Public University
329, University of North Alabama (UNA Florence)  ,12000.0,Alabama, United States,Public University
330, University of West Georgia (UWG)  ,15800.0,Georgia, United States,Public University
331," California State University, Fresno (Fresno State)  ",9000.0,California, United States,Public University
332, University of the District of Columbia (UDC)  ,28000.0,Washington, United States,Public University
333, Saint Xavier University (SXU)  ,14000.0,Illinois, United States,Private University
334, Kentucky State University (KYSU)  ,22000.0,Kentucky, United States,Public University
335," California Polytechnic State University, San Luis Obispo (calpoly)  ",18174.0,California, United States,Public University
336, Mississippi College (MC)  ,9000.0,Mississippi, United States,Private University
337, State University of New York at Oswego (SUNY OSWEGO)  ,11325.0,New York, United States,Public University
338, Colorado Technical University (CTU)  ,28000.0,Colorado, United States,Private University
339, School of the Art Institute of Chicago (SAIC)  ,24975.0,Illinois, United States,Private University
340," University of the Pacific, Stockton (U Pacific)  ",22000.0,California, United States,Private University
341, Towson University (Towson)  ,44280.0,Maryland, United States,Public University
342," Fairleigh Dickinson University, Florham (FDU Florham)  ",19000.0,New Jersey, United States,Private University
343, University of Memphis (U. Memphis)  ,19000.0,Tennessee, United States,Public University
344, St. Cloud State University (SCSU)  ,9000.0,Minnesota, United States,Public University
345," Long Island University, Brooklyn (LIU Brooklyn)  ",18000.0,New York, United States,Private University
346, University of Houston - Clear Lake (UHCL)  ,38382.0,Texas, United States,Public University
347, University of Portland (UP)  ,22914.0,Oregon, United States,Private University
348, Western Illinois University (WIU)  ,19418.0,Illinois, United States,Public University
349, Sonoma State University (Sonoma)  ,10000.0,California, United States,Public University
350, Bowie State University (Bowie State)  ,12000.0,Maryland, United States,Public University
351, Occidental College (OC)  ,54090.0,California, United States,Private University
352, South Dakota State University (SD State)  ,10000.0,South Dakota, United States,Public University
353," City University Of New York, Staten Island (CUNY SI)  ",12000.0,New York, United States,Public University
354, Texas A&M University - Kingsville (TAMUK)  ,16000.0,Texas, United States,Public University
355, Cleveland State University (Cleveland)  ,19333.0,Ohio, United States,Public University
356, Virginia International University (VIU)  ,13000.0,Virginia, United States,Private University
357, Southern Oregon University (SOU)  ,16440.0,Oregon, United States,Public University
358, University Of Phoenix (Phoenix)  ,16830.0,Arizona, United States,Private University
359, University of Massachusetts Dartmouth (UM Dartm)  ,21537.0,Massachusetts, United States,Public University
360, Montana State University at Bozeman (Montana SU)  ,11000.0,Montana, United States,Public University
361, SUNY College of Environmental Science and Forestry (ESF)  ,16320.0,New York, United States,Public University
362," City University Of New York, Brooklyn College (CUNY Br)  ",12000.0,New York, United States,Public University
363, Gannon University (Gannon)  ,17000.0,Pennsylvania, United States,Private University
364, Jacobs University Bremen (Jacobs)  ,12000.0,Bremen, Germany,Private University
365, University of Northern British Columbia (UNBC Canada)  ,15000.0,British Columbia, Canada,Public University
366, University of Prince Edward Island (UPEI)  ,5250.0,Prince Edward Island, Canada,Public University
367," Fleming College, Peterborough (Fleming College)  ",51032.25,Peterborough, Canada,Public University
368, Acadia University (Acadia)  ,16500.0,Nova Scotia, Canada,Public University
369, University of New Brunswick (UNB Canada)  ,12750.0,New Brunswick, Canada,Public University
370, Loyalist College  (Loyalist College )  ,157487.25,Belleville, Canada,Public University
371, University of Guelph (U Guelph)  ,15750.0,Owen Sound, Canada,Public University
372, Luther College (Luther-Regina)  ,31462.5,Saskatchewan, Canada,Private University
373," Niagara College, Welland  (Niagara College)  ",261274.5,Welland, Canada,Public University
374, Laurentian University (Laurentian)  ,11250.0,Owen Sound, Canada,Public University
375, Royal Military College of Canada (RMC Canada)  ,10500.0,Owen Sound, Canada,Public University
376, Université du Québec à Rimouski (UQAR)  ,11250.0,Quebec, Canada,Public University
377," St. Lawrence, Kingston (SLC)  ",125625.0,Kingston, Canada,Public University
378," St. Clair College, Chatham  (St. Clair College)  ",10596.75,Chatham, Canada,Public University
379, University of Manitoba (Manitoba)  ,7500.0,Manitoba, Canada,Public University
380, Lakehead University (Lakehead)  ,12000.0,Owen Sound, Canada,Public University
381, Université du Québec en Abitibi-Témiscamingue (UQAT)  ,13125.0,Quebec, Canada,Public University
382, Brock University (Brock)  ,6000.0,Owen Sound, Canada,Public University
383," St. Lawrence, Cornwall (SLC)  ",12262.5,Cornwall, Canada,Public University
384, University of Windsor (U Windsor)  ,12000.0,Owen Sound, Canada,Public University
385," Fanshawe College, London (Fanshawe College)  ",137748.0,London, Canada,Public University
386," Concordia University, Montreal (Concordia)  ",14250.0,Quebec, Canada,Public University
387, Thompson Rivers University (Thompson Rivers)  ,15000.0,British Columbia, Canada,Public University
388," Saint Mary's University, Nova Scotia (SMU Halifax)  ",15000.0,Nova Scotia, Canada,Public University
389," Fleming College, Lindsay (Fleming College)  ",28467.0,Alberta, Canada,Public University
390, Memorial University of Newfoundland (Memorial)  ,12750.0,Newfoundland & Labrador, Canada,Public University
391, Sault College (Sault College)  ,75255.0,Sault , Canada,Public University
392," Northern College, South Porcupine (Northern College)  ",99139.5,South Porcupine, Canada,Public University
393, University of Prince Edward Island (UPEI)  ,5250.0,Prince Edward Island, Canada,Public University
394," St. Lawrence, Cornwall (SLC)  ",12262.5,Cornwall, Canada,Public University
395, Acadia University (Acadia)  ,16500.0,Nova Scotia, Canada,Public University
396, University of New Brunswick (UNB Canada)  ,12750.0,New Brunswick, Canada,Public University
397, Loyalist College  (Loyalist College )  ,157487.25,Belleville, Canada,Public University
398, University of Guelph (U Guelph)  ,15750.0,Owen Sound, Canada,Public University
399, Luther College (Luther-Regina)  ,31462.5,Saskatchewan, Canada,Private University
400," Fanshawe College, London (Fanshawe College)  ",137748.0,London, Canada,Public University
401, Laurentian University (Laurentian)  ,11250.0,Owen Sound, Canada,Public University
402, Université du Québec à Rimouski (UQAR)  ,11250.0,Quebec, Canada,Public University
403, Royal Military College of Canada (RMC Canada)  ,10500.0,Owen Sound, Canada,Public University
404, University of Prince Edward Island (UPEI)  ,5250.0,Prince Edward Island, Canada,Public University
405, Acadia University (Acadia)  ,16500.0,Nova Scotia, Canada,Public University
406, University of New Brunswick (UNB Canada)  ,12750.0,New Brunswick, Canada,Public University
407, Loyalist College  (Loyalist College )  ,157487.25,Belleville, Canada,Public University
408, University of Guelph (U Guelph)  ,15750.0,Owen Sound, Canada,Public University
409," Niagara College, Welland  (Niagara College)  ",261274.5,Welland, Canada,Public University
410, Luther College (Luther-Regina)  ,31462.5,Saskatchewan, Canada,Private University
411, Laurentian University (Laurentian)  ,11250.0,Owen Sound, Canada,Public University
412, University of Canberra (U Canberra)  ,22255.2,Australian Capital Territory, Australia,Public University
413," Bond University, Gold Coast (Bond)  ",20864.88,Queensland, Australia,Private University
414," Murdoch University, Perth (Murdoch)  ",23603.76,Western Australia, Australia,Public University
415," Australian Catholic University, Sydney (ACU)  ",19537.92,New South Wales, Australia,Public University
416," Charles Sturt University, Bathhurst (CSU Bath)  ",14472.0,New South Wales, Australia,Public University
417," Carnegie Mellon University, Adelaide (CMU Australia)  ",16416.0,South Australia, Australia,Private University
418, Central Queensland University (CQU)  ,20355.84,Queensland, Australia,Public University
419, Charles Darwin University (CDU)  ,18034.559999999998,Northern Territory, Australia,Public University
420," Edith Cowan University, Perth (ECU)  ",18950.399999999998,Western Australia, Australia,Public University
421, Federation University of Australia (Federation Uni)  ,20160.0,Victoria, Australia,Public University
422," The Royal Melbourne Institute of Technology, Bundoora (RMIT)  ",30604.32,Bundoora, Australia,Public University
423," Charles Sturt University, Bathhurst (CSU Bath)  ",14472.0,New South Wales, Australia,Public University
424," Carnegie Mellon University, Adelaide (CMU Australia)  ",16416.0,South Australia, Australia,Private University
425, Central Queensland University (CQU)  ,20355.84,Queensland, Australia,Public University
426, S. Rajaratnam School of International Studies (RSIS)  ,10293.0,Singapore, Singapore,Autonomous University
427, INSEAD Asia Campus (INSEAD)  ,58984.0,Singapore, Singapore,Private University
428, James Cook University Singapore (JCU)  ,36243.04,Singapore, Singapore,Private University
429, National Institute of Education (NIE)  ,9636.0,Singapore, Singapore,Autonomous University
430, Singapore Institute of Technology (SIT)  ,22630.0,Singapore, Singapore,Public University
431, Management Development Institute of Singapore (MDIS)  ,15231.449999999999,Singapore, Singapore,Private University
432, Queen Margaret University (QMU)  ,8395.0,Singapore, Singapore,Public University
433, Lee Kuan Yew School of Public Policy (LKY)  ,21900.0,Singapore, Singapore,Autonomous University
434, Singapore Institute of Management (SIM)  ,24489.309999999998,Singapore, Singapore,Public University
435, Curtin University Singapore (Curtin)  ,23546.88,Singapore, Singapore,Private University
436, Yong Siew Toh Conservatory of Music (YST)  ,43763.5,Singapore, Singapore,Autonomous University
437, Singapore University of Technology and Design (SUTD)  ,19673.5,Singapore, Singapore,Public University
438, Singapore Management University (SMU)  ,24552.09,Singapore, Singapore,Public University
439, Lincoln University (Lincoln NZ)  ,21252.0,Canterbury, New Zealand,Public University
440, Telecom Business School (TBS)  ,3540.0,Île-de-France, France,null University
441, Paris Dauphine University (PDU)  ,7493.0,Paris, France,University
442, Telecom Business School (TBS)  ,3540.0,Île-de-France, France,null University
443, Paris Dauphine University (PDU)  ,7493.0,Paris, France,University
444, Sciences Po (science po)  ,16838.6,Paris, France,University
445," NEOMA Business School, Rouen Campus (NEOMA)  ",18880.0,Paris, France,null University
446, Ecole Normale Supérieure (ENS)  ,18054.0,Paris, France,Public University
447, University of Nantes (nantes)  ,17700.0,Pays de la Loire, France,Public University
448, INSEAD France (INSEAD)  ,95344.0,Île-de-France, France,Private University
449, Lecole de design nantes atlantique (Lecole)  ,9086.0,Pays de la Loire, France,null University
450, Cergy-Pontoise University (CPU)  ,5900.0,Île-de-France, France,Public University
451, American Graduate School in Paris (AGSP)  ,22029.42,Paris, France,University
