,Name,Fees,Region,Country,Type
0,Massachusetts Institute of Technology (MIT) ,49580.0,Massachusetts, United States,Private University
1,Technical University of Munich (TU München) ,7764.0,Bavaria, Germany,Public University
2,University of Toronto (U Toronto) ,33000.0,Owen Sound, Canada,Public University
3,University of Melbourne (Uni Melb) ,28454.399999999998,Victoria, Australia,Public University
4,National University Of Singapore (NUS) ,27886.0,Singapore, Singapore,Public University
5,Nanyang Technological University (NTU) ,12191.0,Singapore, Singapore,Public University
6,University of Auckland (U Auckland) ,23100.0,Auckland, New Zealand,Public University
7,The University of Tokyo (Utokyo) ,10340.0,Tokyo, Japan,Public University
8,University of Glasgow (GLA) ,25545.0,Glasgow City, United Kingdom,Public University
9,University of Cambridge (Cambridge) ,28296.0,Cambridgeshire, United Kingdom,Research University
10,Delft University of Technology (TU Delft) ,17895.879999999997,South Holland, Netherlands,Public University
11,Trinity College Dublin (TCD) ,8366.199999999999,Leinster, Ireland,University
12,"KTH, Royal Institute of Technology (KTH) ",17050.0,Stockholms l'n, Sweden,Public University
13,ETH Zurich (ETHZ) ,18966.0,Z'rich, Switzerland,Public University
14,Stanford University (Stanford) ,36010.0,California, United States,Private University
15,Tokyo Institute of Technology (Tokyo Tech) ,321480.0,Baden-Warttemberg, Germany,Public University
16,"The University of British Columbia, Vancouver (UBC Vancouver) ",6750.0,British Columbia, Canada,Public University
17,"University of New South Wales, Sydney (UNSW) ",33249.6,New South Wales, Australia,Public University
18,University of Canterbury (U Canterbury) ,19800.0,Canterbury, New Zealand,Public University
19,Ecole Polytechnique (Ecole) ,22302.0,Palaiseau, France,Public University
20,University of Bath (Bath) ,23187.0,Bath and North East Somerset, United Kingdom,Public University
21,Imperial College London (Imperial) ,37990.0,London, United Kingdom,Public University
22,Eindhoven University of Technology (Tue) ,17700.0,North Brabant, Netherlands,Public University
23,University of Amsterdam (UvA) ,17700.0,North Holland, Netherlands,Public University
24,University College Dublin (UCD) ,24780.0,Leinster, Ireland,Public University
25,Chalmers University of Technology (Chalmers) ,10450.0,Stockholms l'n, Sweden,Private University
26,Ecole Polytechnique Fédérale de Lausanne (EPFL) ,20699.100000000002,Vaud, Switzerland,Public University
27, State University of New York (Albany) (SUNY Albany)  ,23000.0,New York, United States,Public University
28, Monmouth University (Monmouth)  ,16000.0,Illinois, United States,Private University
29, Harvey Mudd College (HMC)  ,56331.0,California, United States,Private University
30, Middle Tennessee State University (MTSU)  ,26000.0,Tennessee, United States,Public University
31, University of Houston-Victoria (UHV)  ,32000.0,Texas, United States,Public University
32, Appalachian State University (App State)  ,17000.0,North Carolina, United States,Public University
33, East Stroudsburg University (ESU)  ,11000.0,Pennsylvania, United States,Public University
34, Arkansas Tech University (ATU)  ,11544.0,Arkansas, United States,Public University
35, Montclair State University (Montclair)  ,15000.0,New Jersey, United States,Public University
36, Georgia State University (GSU)  ,19000.0,Georgia, United States,Public University
37, Rhode Island School of Design (RISD)  ,49900.0,Rhode Island, United States,Private University
38, Northwestern Polytechnic University (NPU)  ,12150.0,California, United States,Private University
39," New York Institute of Technology, Manhattan (NYIT)  ",18000.0,New York, United States,Private University
40, Chicago State University (Chicago St)  ,19000.0,Illinois, United States,Public University
41, University of Detroit Mercy (UDMercy)  ,27666.0,Michigan, United States,Private University
42, Loyola University Chicago (LUC)  ,14000.0,Ohio, United States,Private University
43, Stratford University (Stratford)  ,27000.0,Virginia, United States,Private University
44, University of Hartford (Hartford)  ,23291.0,Connecticut, United States,Private University
45, Southern Arkansas University (SAU Mag)  ,8000.0,Arkansas, United States,Public University
46, University of Rhode Island (U.Rhode Isl)  ,25854.0,Rhode Island, United States,Public University
47," California State University, San Bernardino (CSU SB)  ",24000.0,California, United States,Public University
48, Franklin W. Olin College of Engineering (OCE)  ,52164.0,Massachusetts, United States,Private University
49, Fordham University (Fordham)  ,23000.0,New York, United States,Private University
50, University of Colorado at Colorado Springs (UCCS)  ,20000.0,Colorado, United States,Public University
51, University of South Dakota (USD)  ,10000.0,South Dakota, United States,Public University
52, Texas A&M University - Commerce (TAMUC)  ,31000.0,Texas, United States,Public University
53, The College of Saint Rose (Strose)  ,14000.0,New York, United States,Private University
54," University of Alaska, Fairbanks (UAF)  ",13000.0,Alaska, United States,Public University
55, Pittsburg State University (Pitt State)  ,18575.0,Kansas, United States,Public University
56," University of Nevada, Las Vegas (UN LV)  ",23000.0,Nevada, United States,Public University
57, University of New Haven (New Haven)  ,16000.0,Connecticut, United States,Private University
58, James Madison University (JMU)  ,18000.0,Virginia, United States,Public University
59, California Polytechnic State University (Cal Poly)  ,21000.0,California, United States,Public University
60, Merrimack College (Merrimack)  ,27680.0,Massachusetts, United States,Private University
61, Monroe college (Monroe)  ,14550.0,New York, United States,Private University
62, New York Film Academy South Beach Campus (NYFA SB)  ,12666.0,Florida, United States,Private University
63, Capitol Technology University (CapTechU)  ,21060.0,Maryland, United States,Private University
64," Fontbonne University, St Louis (Fontbonne)  ",12654.0,Missouri, United States,Private University
65, Macalester College (MC)  ,56292.0,Minnesota, United States,Private University
66," Furman University, Greenville (Furman)  ",23582.0,South Carolina, United States,Private University
67, Purdue University Northwest (PNW)  ,16625.0,Indiana, United States,Public University
68, Sacred Heart University (Sacred Heart)  ,16000.0,Connecticut, United States,Private University
69, Christopher Newport University (CNU)  ,16000.0,Virginia, United States,Public University
70, Bridgewater State University (BridgeW)  ,6000.0,Massachusetts, United States,Public University
71, Baruch College - The City University of New York (CUNY Baruch)  ,27600.0,New York, United States,Public University
72, Embry Riddle Aeronautical University (ERAU)  ,17590.0,Florida, United States,Private University
73, St Martin University (Stmartin)  ,14280.0,Washington, United States,Private University
74, University of Portland (UP)  ,22914.0,Oregon, United States,Private University
75, Bridgewater State University (BridgeW)  ,6000.0,Massachusetts, United States,Public University
76, Christopher Newport University (CNU)  ,16000.0,Virginia, United States,Public University
77, Villanova University (Villanova)  ,28000.0,Pennsylvania, United States,Private University
78, Towson University (Towson)  ,44280.0,Maryland, United States,Public University
79, The University of Alabama (U Alabama)  ,18000.0,Alabama, United States,Public University
80, St Martin University (Stmartin)  ,14280.0,Washington, United States,Private University
81, Baruch College - The City University of New York (CUNY Baruch)  ,27600.0,New York, United States,Public University
82, School of the Art Institute of Chicago (SAIC)  ,24975.0,Illinois, United States,Private University
83, St. Cloud State University (SCSU)  ,9000.0,Minnesota, United States,Public University
84," California State University, Fresno (Fresno State)  ",9000.0,California, United States,Public University
85, Wake Forest University (WFU)  ,77500.0,North Carolina, United States,Private University
86, Denison University (DU)  ,52620.0,Ohio, United States,Private University
87, University of Massachusetts Dartmouth (UM Dartm)  ,21537.0,Massachusetts, United States,Public University
88, Old Dominion University (ODU)  ,17400.0,Virginia, United States,Public University
89, The College of New Jersey (TCNJ)  ,21436.0,New Jersey, United States,Public University
90, Penn State Harrisburg (PSU HBG)  ,27000.0,Pennsylvania, United States,Public University
91, Bowie State University (Bowie State)  ,12000.0,Maryland, United States,Public University
92, University of Alabama at Birmingham (UA Birmingh)  ,16000.0,Alabama, United States,Public University
93, Western Washington University (WWU)  ,21000.0,Washington, United States,Public University
94, State University of New York – New Paltz (SUNY NP)  ,14000.0,New York, United States,Public University
95, Western Illinois University (WIU)  ,19418.0,Illinois, United States,Public University
96," California State University, Channel Islands (CSU CI)  ",18000.0,California, United States,Public University
97," University of Redlands, Diego (Redlands Diego)  ",35574.0,California, United States,Private University
98, East Carolina University (ECU)  ,20000.0,North Carolina, United States,Public University
99, State University of New York Polytechnic Institute (SUNY Poly)  ,11000.0,New York, United States,Public University
100, Wellesley College (WC)  ,53408.0,Massachusetts, United States,Private University
101, Kennesaw State University (Kennesaw)  ,28000.0,Georgia, United States,Public University
102, Swarthmore College (SC)  ,54256.0,Pennsylvania, United States,Private University
103," University of Michigan, Flint (Flint)  ",22170.0,Michigan, United States,Public University
104, Roosevelt University (Roosevelt)  ,19000.0,Illinois, United States,Private University
105, University of Central Missouri (UCMO)  ,20048.0,Missouri, United States,Public University
106, Midwestern State University (MWSU)  ,30000.0,Texas, United States,Public University
107," California State University, San Marcos (CSU SM)  ",20000.0,California, United States,Public University
108," Washington State University,Vancouver (WSU Vanco)  ",26000.0,Washington, United States,Public University
109, State University of New York (Albany) (SUNY Albany)  ,23000.0,New York, United States,Public University
110, Amherst College (amherst)  ,55520.0,Massachusetts, United States,Private University
111, International Technological University (ITU)  ,16200.0,California, United States,Private University
112, Emory University (Emory)  ,29000.0,Georgia, United States,Private University
113," University of Southern Mississippi, Gulf Coast (USM Gulf)  ",50000.0,Michigan, United States,Public University
114, Monmouth University (Monmouth)  ,16000.0,Illinois, United States,Private University
115, Tulane University of Louisiana (Tulane)  ,14234.0,Louisiana, United States,Private University
116," California State University, Northridge (CSUN)  ",6000.0,California, United States,Public University
117, Catholic University Of America (CUA)  ,41000.0,District of Columbia, United States,Private University
118, University of Oregon (U. Oregon)  ,10000.0,Oregon, United States,Public University
119, Lawrence Technological University (LTU)  ,15000.0,Michigan, United States,Private University
120, University of Colorado at Denver (UC Denver)  ,28212.0,Colorado, United States,Public University
121, University of Texas - Permian Basin (UTPB)  ,12000.0,Texas, United States,Public University
122, Bowling Green State University (BGSU)  ,19000.0,Ohio, United States,Public University
123, University of North Florida (UNF)  ,32011.0,Florida, United States,Public University
124, Montana Tech (Montana Tech)  ,23000.0,Montana, United States,Public University
125," University of Southern Mississippi, Gulf Coast (USM Gulf)  ",50000.0,Michigan, United States,Public University
126, California State University Chico (CSU Chico)  ,16434.0,California, United States,Public University
127, University of Houston-Victoria (UHV)  ,32000.0,Texas, United States,Public University
128, Florida Atlantic University (FAU)  ,16000.0,Florida, United States,Public University
129, The University of Southern Mississippi (USM)  ,26000.0,Mississippi, United States,Public University
130, Lawrence Technological University (LTU)  ,15000.0,Michigan, United States,Private University
131, Illinois State University (Illinois State)  ,14544.0,Illinois, United States,Public University
132, Pomona College (Pomona)  ,54380.0,California, United States,Private University
133, University of Louisiana at Lafayette (U.SW Louisi)  ,24816.0,Louisiana, United States,Public University
134, University of South Dakota (USD)  ,10000.0,South Dakota, United States,Public University
135, Texas Southern University (TX SU)  ,20000.0,Texas, United States,Public University
136, Kent State University (Kent SU)  ,15000.0,Ohio, United States,Public University
137, Alcorn State University (Alcorn)  ,13000.0,Mississippi, United States,Public University
138, Central Michigan University (C Mich)  ,12000.0,Michigan, United States,Public University
139, Stratford University (Stratford)  ,27000.0,Virginia, United States,Private University
140, Eastern Oregon University (EOU)  ,7884.0,Oregon, United States,Public University
141, East Tennessee State University (ETSU)  ,14000.0,Tennessee, United States,Public University
142, University of Texas - Pan American (UTPA)  ,42000.0,Texas, United States,Public University
143, North Carolina A&T State University (NCAT)  ,17150.0,North Carolina, United States,Public University
144, California Baptist University (CalBaptist)  ,13333.0,California, United States,Private University
145, Kutztown University of Pennsylvania (Kutztown)  ,13050.0,Pennsylvania, United States,Public University
146, Nova Southeastern University (Nova)  ,11000.0,Florida, United States,Private University
147, Saint Peter's University (SPU NJ)  ,25968.0,New Jersey, United States,Private University
148, Carnegie Mellon University silicon valley (CMUSV)  ,83724.0,California, United States,Private University
149, Milwaukee School of Engineering (MSOE)  ,19000.0,Wisconsin, United States,Private University
150, Valparaiso University (Valpo)  ,20295.0,Indiana, United States,Private University
151, Maharishi University of Management (MUM)  ,27530.0,Iowa, United States,Private University
152, Pace University (Pace)  ,18000.0,New York, United States,Private University
153, University of Memphis (U. Memphis)  ,19000.0,Tennessee, United States,Public University
154, Youngstown State University (YSU)  ,16230.0,Ohio, United States,Private University
155, University of Houston - Clear Lake (UHCL)  ,38382.0,Texas, United States,Public University
156," University of the Pacific, Stockton (U Pacific)  ",22000.0,California, United States,Private University
157," Fairleigh Dickinson University, Florham (FDU Florham)  ",19000.0,New Jersey, United States,Private University
158," Johnson and Wales University, Providence (JWU Providence)  ",12636.0,Rhode Island, United States,Private University
159, Williams College (williams)  ,55140.0,Massachusetts, United States,University
160, Southern Adventist University (SAU TN)  ,9000.0,Tennessee, United States,Private University
161, Western Michigan University (W Mich)  ,34000.0,Michigan, United States,Public University
162, University of Texas Rio Grande Valley (UTRGV)  ,29924.0,Texas, United States,Public University
163," City University Of New York, Staten Island (CUNY SI)  ",12000.0,New York, United States,Public University
164, New York Film Academy Los Angeles Campus (NYFA LA)  ,12666.0,California, United States,Private University
165, Cleveland State University (Cleveland)  ,19333.0,Ohio, United States,Public University
166, Central Connecticut State University (CCSU)  ,11878.0,Connecticut, United States,Public University
167, Southern Oregon University (SOU)  ,16440.0,Oregon, United States,Public University
168, Bucknell University (bucknell)  ,28894.0,Pennsylvania, United States,Private University
169, Montana State University at Bozeman (Montana SU)  ,11000.0,Montana, United States,Public University
170, Oakland University (Oakland)  ,16000.0,Michigan, United States,Public University
171, Indiana Tech (Indiana Tech)  ,20052.0,Indiana, United States,Private University
172, University of North Texas (UNT)  ,23140.0,Texas, United States,Public University
173," City University Of New York, Brooklyn College (CUNY Br)  ",12000.0,New York, United States,Public University
174, Marymount University (Marymount)  ,30990.0,Virginia, United States,Private University
175, Claremont Graduate University (CGU)  ,22800.0,California, United States,Private University
176, University of Bridgeport (Bridgeport)  ,24000.0,Connecticut, United States,Private University
177, Southern University and A&M College (SUBR)  ,23000.0,Louisiana, United States,Public University
178, University of Wisconsin-Platteville (UW Platt)  ,10000.0,Wisconsin, United States,Public University
179, University of Tampa (U Tampa)  ,18816.0,Florida, United States,Private University
180, University of San Diego (sandiego)  ,22500.0,California, United States,Private University
181," University of Washington, Tacoma (UW Tacoma)  ",32814.0,Washington, United States,Public University
182, University of Denver (U Denver)  ,95040.0,Colorado, United States,Private University
183, East Carolina University (ECU)  ,20000.0,North Carolina, United States,Public University
184, Rowan University (Rowan)  ,16000.0,New Jersey, United States,Public University
185, Florida Institute of Technology (FIT)  ,18000.0,Florida, United States,Private University
186, University of South Alabama (South Alabama)  ,15948.0,Alabama, United States,Public University
187," New York Institute of Technology, Old Westbury (NYIT WB)  ",22500.0,New York, United States,Private University
188," California State University, Long Beach (CSU LB)  ",41000.0,California, United States,Public University
189, University of Toledo (U. Toledo)  ,48000.0,Ohio, United States,Public University
190, Keck Graduate Institute (KGI)  ,39900.0,California, United States,Private University
191, Seattle University (Seattle U)  ,17000.0,Washington, United States,Private University
192, Wellesley College (WC)  ,53408.0,Massachusetts, United States,Private University
193, Swarthmore College (SC)  ,54256.0,Pennsylvania, United States,Private University
194," University of Michigan, Flint (Flint)  ",22170.0,Michigan, United States,Public University
195, Fairleigh Dickinson University (FDU)  ,19000.0,New Jersey, United States,Private University
196, Alabama A&M University (AAMU)  ,11790.0,Alabama, United States,Public University
197, Hofstra University (Hofstra)  ,19000.0,New York, United States,Private University
198," California State University, East Bay (CSUEB)  ",15557.0,California, United States,Public University
199, Amherst College (amherst)  ,55520.0,Massachusetts, United States,Private University
200, Montana Tech (Montana Tech)  ,23000.0,Montana, United States,Public University
201," University of Southern Mississippi, Gulf Coast (USM Gulf)  ",50000.0,Michigan, United States,Public University
202," City University Of New York, Queens College (QC CUNY)  ",12000.0,New York, United States,Public University
203, Columbus State University (Columbus)  ,10537.0,Georgia, United States,Public University
204," New York Institute of Technology, Manhattan (NYIT)  ",18000.0,New York, United States,Private University
205, University of Colorado at Denver (UC Denver)  ,28212.0,Colorado, United States,Public University
206," Saint Xavier University, Illinois- Orland Park (SXU Orland)  ",14000.0,Illinois, United States,Private University
207," Lipscomb University, Nashville (Lipscomb)  ",30000.0,Tennessee, United States,Private University
208, Troy University (Troy)  ,12000.0,Alabama, United States,Public University
209, University of Detroit Mercy (UDMercy)  ,27666.0,Michigan, United States,Private University
210, University of Mary Hardin-Baylor (UMHB)  ,29880.0,Texas, United States,Private University
211, Appalachian State University (App State)  ,17000.0,North Carolina, United States,Public University
212," California State University, Fullerton (Fullerton)  ",15457.0,California, United States,Public University
213, Wilmington University (Wilmington)  ,25000.0,Delaware, United States,Private University
214, Montclair State University (Montclair)  ,15000.0,New Jersey, United States,Public University
215, Soka University of America (Soka)  ,32527.0,California, United States,Private University
216, University of Atlanta (U of A)  ,13000.0,Georgia, United States,Private University
217, Franklin W. Olin College of Engineering (OCE)  ,52164.0,Massachusetts, United States,Private University
218, Tennessee Technological University (TN Tech)  ,22000.0,Tennessee, United States,Public University
219, Kent State University (Kent SU)  ,15000.0,Ohio, United States,Public University
220," Kettering University, Flint (Kettering)  ",21000.0,Michigan, United States,Private University
221, University of Texas at Tyler (UT Tyler)  ,24588.0,Texas, United States,Public University
222, Eastern Oregon University (EOU)  ,7884.0,Oregon, United States,Public University
223," California State University, Dominguez Hills (CSU DH)  ",18717.0,California, United States,Public University
224, University of the Potomac (Potomac)  ,11000.0,District of Columbia, United States,Private University
225, The University of Vermont (Vermont)  ,37000.0,Vermont, United States,Public University
226, Lafayette College (LC)  ,52415.0,Pennsylvania, United States,Private University
227," University of Redlands, South Coast Metro (Redlands, SCM)  ",35574.0,California, United States,Private University
228, Georgia Southwestern State University (GSW)  ,10000.0,Georgia, United States,Public University
229, Loyola Marymount University (LMU)  ,15386.0,California, United States,Private University
230, Alcorn State University (Alcorn)  ,13000.0,Mississippi, United States,Public University
231, Franklin W. Olin College of Engineering (OCE)  ,52164.0,Massachusetts, United States,Private University
232, Kent State University (Kent SU)  ,15000.0,Ohio, United States,Public University
233, Westcliff University (WU)  ,32250.0,California, United States,Private University
234," Kettering University, Flint (Kettering)  ",21000.0,Michigan, United States,Private University
235, Eastern Washington University (EWU)  ,26000.0,Washington, United States,Public University
236, Eastern Oregon University (EOU)  ,7884.0,Oregon, United States,Public University
237, Nova Southeastern University (Nova)  ,11000.0,Florida, United States,Private University
238, University of New Orleans (UNO)  ,20000.0,Louisiana, United States,Public University
239, Maharishi University of Management (MUM)  ,27530.0,Iowa, United States,Private University
240, California Baptist University (CalBaptist)  ,13333.0,California, United States,Private University
241, Carnegie Mellon University silicon valley (CMUSV)  ,83724.0,California, United States,Private University
242, Creighton University (cerighton)  ,15660.0,Nebraska, United States,Private University
243," University of Michigan, Dearborn (UM Dearborn)  ",23670.0,Michigan, United States,Public University
244, Portland State University (PSU)  ,16000.0,Oregon, United States,Public University
245, University of Scranton (Scranton)  ,17370.0,Pennsylvania, United States,Private University
246, McNeese State University (McNeese)  ,18400.0,Louisiana, United States,Public University
247, Christian Brothers University (CBU)  ,18000.0,Tennessee, United States,Private University
248," University of the Pacific, Stockton (U Pacific)  ",22000.0,California, United States,Private University
249," University of the Pacific, Stockton (U Pacific)  ",22000.0,California, United States,Private University
250," Johnson and Wales University, Providence (JWU Providence)  ",12636.0,Rhode Island, United States,Private University
251, Towson University (Towson)  ,44280.0,Maryland, United States,Public University
252, Christian Brothers University (CBU)  ,18000.0,Tennessee, United States,Private University
253, Baruch College - The City University of New York (CUNY Baruch)  ,27600.0,New York, United States,Public University
254, St. Cloud State University (SCSU)  ,9000.0,Minnesota, United States,Public University
255," University of Dallas, Irving (UDallas)  ",23400.0,Texas, United States,Private University
256, University Of Phoenix (Phoenix)  ,16830.0,Arizona, United States,Private University
257, Wake Forest University (WFU)  ,77500.0,North Carolina, United States,Private University
258, University of Massachusetts Dartmouth (UM Dartm)  ,21537.0,Massachusetts, United States,Public University
259, Sonoma State University (Sonoma)  ,10000.0,California, United States,Public University
260, The College of New Jersey (TCNJ)  ,21436.0,New Jersey, United States,Public University
261, Bowie State University (Bowie State)  ,12000.0,Maryland, United States,Public University
262, Occidental College (OC)  ,54090.0,California, United States,Private University
263, Southern Adventist University (SAU TN)  ,9000.0,Tennessee, United States,Private University
264, State University of New York – New Paltz (SUNY NP)  ,14000.0,New York, United States,Public University
265, Central Connecticut State University (CCSU)  ,11878.0,Connecticut, United States,Public University
266, University of Texas Rio Grande Valley (UTRGV)  ,29924.0,Texas, United States,Public University
267, Franklin University (Franklin)  ,11000.0,Ohio, United States,Private University
